{
  "schemaVersion": 1,
  "kind": "engineering-process-authority-transition-evidence",
  "project": "sample-project",
  "changeId": "adopt-process-0-9-0",
  "cycle": 1,
  "requestSha256": "sha256:0000000000000000000000000000000000000000000000000000000000000000",
  "sourceAuthority": {"version": "0.7.0", "digest": "sha256:0000000000000000000000000000000000000000000000000000000000000000"},
  "targetAuthority": {"version": "0.9.0", "digest": "sha256:1111111111111111111111111111111111111111111111111111111111111111"},
  "candidate": {
    "baseCheckpoint": "0000000000000000000000000000000000000000",
    "checkpoint": "2222222222222222222222222222222222222222",
    "tree": "3333333333333333333333333333333333333333",
    "workspaceFingerprint": "sha256:2222222222222222222222222222222222222222222222222222222222222222",
    "workingTreeDirty": false,
    "changedPaths": [".agents/skills/run-change/SKILL.md", ".process/process.lock", "requirements/process.txt"]
  },
  "bindings": {
    "requirementsInputSha256": "sha256:0000000000000000000000000000000000000000000000000000000000000000",
    "requirementsLockSha256": "sha256:1111111111111111111111111111111111111111111111111111111111111111",
    "processLockSha256": "sha256:2222222222222222222222222222222222222222222222222222222222222222",
    "projectManifestSha256": "sha256:3333333333333333333333333333333333333333333333333333333333333333",
    "projectMigrationSha256": null,
    "managedDistributionSha256": "sha256:4444444444444444444444444444444444444444444444444444444444444444",
    "actionPinsSha256": "sha256:5555555555555555555555555555555555555555555555555555555555555555"
  },
  "materialization": {"status": "passed", "finalStateChecks": 2, "issues": []},
  "generatedBy": {"actorId": "candidate-materializer", "contextId": "candidate-context", "kind": "agent"},
  "generatedAt": "2026-01-02T00:00:00Z"
}
